"No.","Time","Source","Destination","Protocol","Length","Info"
"677","27.096779","162.125.4.19","10.110.30.14","TCP","1440","443  >  59336 [PSH, ACK] Seq=181953 Ack=908 Win=66560 Len=1374 TSval=2972565052 TSecr=976412153"
"713","27.102950","162.125.4.19","10.110.30.14","TCP","1440","443  >  59336 [ACK] Seq=203937 Ack=908 Win=66560 Len=1374 TSval=2972565057 TSecr=976412155"
"2152","116.091048","17.248.254.47","10.110.30.14","TCP","1440","443  >  59340 [PSH, ACK] Seq=177060 Ack=2657 Win=64128 Len=1374 TSval=405588526 TSecr=976500702"
"2321","116.302148","17.248.185.230","10.110.30.14","TCP","1414","[TCP Previous segment not captured] 443  >  59341 [PSH, ACK] Seq=2749 Ack=518 Win=64768 Len=1348 TSval=3662669876 TSecr=976500853"
"3620","192.915358","17.253.125.201","10.110.30.14","HTTP","576","[TCP Previous segment not captured] Continuation"
"3813","202.585855","142.250.72.100","10.110.30.14","TCP","1440","443  >  59346 [ACK] Seq=19543 Ack=2251 Win=71424 Len=1374 TSval=2445662174 TSecr=976586690"
"3913","202.862322","3.218.170.225","10.110.30.14","TCP","1321","[TCP Previous segment not captured] 443  >  59347 [PSH, ACK] Seq=6871 Ack=518 Win=28160 Len=1255 TSval=1407479172 TSecr=976586956"
"4181","204.268089","3.218.170.225","10.110.30.14","TCP","1440","443  >  59347 [ACK] Seq=107578 Ack=59728 Win=123136 Len=1374 TSval=1407480578 TSecr=976588318"
"4324","204.622137","3.218.170.225","10.110.30.14","TCP","1440","[TCP Fast Retransmission] 443  >  59347 [ACK] Seq=203758 Ack=59728 Win=123136 Len=1374 TSval=1407480932 TSecr=976588655"
"4456","205.192014","3.218.170.225","10.110.30.14","TCP","1440","443  >  59347 [ACK] Seq=306808 Ack=59728 Win=123136 Len=1374 TSval=1407481502 TSecr=976589204"
"4525","205.398709","3.218.170.225","10.110.30.14","TCP","1440","[TCP Previous segment not captured] 443  >  59347 [ACK] Seq=360394 Ack=59728 Win=123136 Len=1374 TSval=1407481708 TSecr=976589402"
"4655","205.916114","3.218.170.225","10.110.30.14","TCP","1440","443  >  59347 [ACK] Seq=451078 Ack=59728 Win=123136 Len=1374 TSval=1407482226 TSecr=976589902"
"4676","206.033366","3.218.170.225","10.110.30.14","TCP","1440","443  >  59347 [ACK] Seq=466192 Ack=59728 Win=123136 Len=1374 TSval=1407482344 TSecr=976590014"
"4875","206.959453","3.218.170.225","10.110.30.14","TCP","1440","443  >  59347 [ACK] Seq=599470 Ack=59728 Win=123136 Len=1374 TSval=1407483270 TSecr=976590907"
"5054","207.759569","3.218.170.225","10.110.30.14","TCP","1440","443  >  59347 [ACK] Seq=717634 Ack=59728 Win=123136 Len=1374 TSval=1407484069 TSecr=976591682 [TCP segment of a reassembled PDU]"
"5068","207.838275","3.218.170.225","10.110.30.14","TCP","1440","[TCP Previous segment not captured] 443  >  59347 [ACK] Seq=730000 Ack=59728 Win=123136 Len=1374 TSval=1407484148 TSecr=976591760"
"5096","207.918993","3.218.170.225","10.110.30.14","TCP","1440","443  >  59347 [ACK] Seq=746488 Ack=59728 Win=123136 Len=1374 TSval=1407484229 TSecr=976591838"
"5137","208.112539","3.218.170.225","10.110.30.14","TCP","1440","443  >  59347 [ACK] Seq=778090 Ack=59728 Win=123136 Len=1374 TSval=1407484423 TSecr=976592024"
"5163","208.236569","3.218.170.225","10.110.30.14","TCP","1440","443  >  59347 [ACK] Seq=795952 Ack=59728 Win=123136 Len=1374 TSval=1407484546 TSecr=976592141"
"5384","208.971098","3.218.170.225","10.110.30.14","TCP","1440","443  >  59347 [ACK] Seq=959458 Ack=59728 Win=123136 Len=1374 TSval=1407485277 TSecr=976592850"
"5475","209.264286","3.218.170.225","10.110.30.14","TCP","1440","[TCP Previous segment not captured] 443  >  59347 [ACK] Seq=1029532 Ack=59728 Win=123136 Len=1374 TSval=1407485574 TSecr=976593134"
"5570","209.541774","3.218.170.225","10.110.30.14","TCP","1440","[TCP Previous segment not captured] 443  >  59347 [ACK] Seq=1080370 Ack=59728 Win=123136 Len=1374 TSval=1407485852 TSecr=976593398"
"5727","210.193313","3.218.170.225","10.110.30.14","TCP","1440","443  >  59347 [ACK] Seq=1191664 Ack=59728 Win=123136 Len=1374 TSval=1407486504 TSecr=976594028"
"5743","210.276247","3.218.170.225","10.110.30.14","TCP","1440","443  >  59347 [ACK] Seq=1202656 Ack=59728 Win=123136 Len=1374 TSval=1407486586 TSecr=976594107"
"5757","210.335421","3.218.170.225","10.110.30.14","TCP","1440","443  >  59347 [ACK] Seq=1215022 Ack=59728 Win=123136 Len=1374 TSval=1407486646 TSecr=976594165"
"5818","210.639947","3.218.170.225","10.110.30.14","TCP","1440","443  >  59347 [ACK] Seq=1257616 Ack=59728 Win=123136 Len=1374 TSval=1407486951 TSecr=976594459"
"6216","211.610688","152.199.24.163","10.110.30.14","TCP","1440","[TCP Fast Retransmission] 443  >  59354 [ACK] Seq=57380 Ack=2477 Win=72192 Len=1374 TSval=1009847822 TSecr=976595389"
"6482","212.219640","3.218.170.225","10.110.30.14","TCP","1440","443  >  59347 [ACK] Seq=1487074 Ack=59728 Win=123136 Len=1374 TSval=1407488530 TSecr=976595946"
"6782","213.312054","3.218.170.225","10.110.30.14","TCP","1440","[TCP Previous segment not captured] 443  >  59347 [ACK] Seq=1691800 Ack=59728 Win=123136 Len=1374 TSval=1407489622 TSecr=976596995"
"6829","213.589300","3.218.170.225","10.110.30.14","TCP","1440","443  >  59347 [ACK] Seq=1719280 Ack=59728 Win=123136 Len=1374 TSval=1407489900 TSecr=976597265"
"7019","214.158446","3.218.170.225","10.110.30.14","TCP","1440","443  >  59347 [ACK] Seq=1859428 Ack=59728 Win=123136 Len=1374 TSval=1407490469 TSecr=976597817"
"7082","214.436537","3.218.170.225","10.110.30.14","TCP","1440","[TCP Previous segment not captured] 443  >  59347 [ACK] Seq=1900648 Ack=59728 Win=123136 Len=1374 TSval=1407490747 TSecr=976598086"
"7327","215.148244","3.218.170.225","10.110.30.14","TCP","1440","443  >  59347 [ACK] Seq=2039422 Ack=59728 Win=123136 Len=1374 TSval=1407491458 TSecr=976598768"
"7571","215.924546","3.218.170.225","10.110.30.14","TCP","1440","443  >  59347 [ACK] Seq=2183692 Ack=59728 Win=123136 Len=1374 TSval=1407492235 TSecr=976599512"
"8182","218.112809","23.40.60.153","10.110.30.14","HTTP","413","[TCP Previous segment not captured] Continuation"
"8672","219.912031","3.218.170.225","10.110.30.14","TCP","1440","[TCP Fast Retransmission] 443  >  59347 [ACK] Seq=2850082 Ack=59728 Win=123136 Len=1374 TSval=1407496222 TSecr=976603338"
"8808","220.439208","3.218.170.225","10.110.30.14","TCP","1440","443  >  59347 [ACK] Seq=2946262 Ack=59728 Win=123136 Len=1374 TSval=1407496749 TSecr=976603845"
"9236","221.755991","3.218.170.225","10.110.30.14","TCP","1440","443  >  59347 [ACK] Seq=3218314 Ack=59728 Win=123136 Len=1374 TSval=1407498067 TSecr=976605109"
"9253","221.794517","3.218.170.225","10.110.30.14","TCP","1440","443  >  59347 [ACK] Seq=3229306 Ack=59728 Win=123136 Len=1374 TSval=1407498105 TSecr=976605147"
"9600","222.727989","3.218.170.225","10.110.30.14","TCP","1440","443  >  59347 [ACK] Seq=3429910 Ack=59728 Win=123136 Len=1374 TSval=1407499038 TSecr=976606043"
"9728","222.905612","52.217.18.148","10.110.30.14","TCP","1440","443  >  59362 [ACK] Seq=72511 Ack=1301 Win=31744 Len=1386"
"9840","223.087307","3.218.170.225","10.110.30.14","TCP","1440","443  >  59347 [ACK] Seq=3532960 Ack=59728 Win=123136 Len=1374 TSval=1407499398 TSecr=976606383"
"9880","223.125883","3.218.170.225","10.110.30.14","TCP","1440","443  >  59347 [ACK] Seq=3543952 Ack=59728 Win=123136 Len=1374 TSval=1407499436 TSecr=976606418"
"10135","223.581940","3.218.170.225","10.110.30.14","TCP","1440","443  >  59347 [ACK] Seq=3656620 Ack=59728 Win=123136 Len=1374 TSval=1407499892 TSecr=976606848"
"10247","223.921002","3.218.170.225","10.110.30.14","TCP","1440","443  >  59347 [ACK] Seq=3707458 Ack=59728 Win=123136 Len=1374 TSval=1407500231 TSecr=976607173"
"10353","224.198763","3.218.170.225","10.110.30.14","TCP","1440","443  >  59347 [ACK] Seq=3787150 Ack=59728 Win=123136 Len=1374 TSval=1407500509 TSecr=976607442"
"11175","226.352974","3.218.170.225","10.110.30.14","TLSv1.2","1440","Application Data"
"11495","226.980527","3.218.170.225","10.110.30.14","TCP","1440","443  >  59347 [ACK] Seq=4082716 Ack=83491 Win=172288 Len=1374 TSval=1407503291 TSecr=976610079"
"11763","228.031406","3.223.27.148","10.110.30.14","TCP","1306","[TCP Previous segment not captured] 443  >  59374 [PSH, ACK] Seq=4123 Ack=518 Win=28160 Len=1240 TSval=2859613831 TSecr=976611092"
"11785","228.143708","54.205.44.255","10.110.30.14","TCP","1306","[TCP Previous segment not captured] 443  >  59375 [PSH, ACK] Seq=4123 Ack=518 Win=28160 Len=1240 TSval=3115573091 TSecr=976611195"
"12129","234.984435","54.241.191.146","10.110.30.14","TCP","1440","443  >  59376 [ACK] Seq=26426 Ack=3677 Win=34304 Len=1374 TSval=2408800876 TSecr=976617879"
"12208","235.449442","54.241.191.146","10.110.30.14","TCP","1440","443  >  59376 [ACK] Seq=41540 Ack=3677 Win=34304 Len=1374 TSval=2408801341 TSecr=976618336"
"12359","236.409673","54.241.191.146","10.110.30.14","TCP","1440","443  >  59379 [ACK] Seq=37202 Ack=2096 Win=31232 Len=1374 TSval=2408802302 TSecr=976619272"
"12384","236.594087","54.241.191.146","10.110.30.14","TCP","1440","443  >  59379 [ACK] Seq=45446 Ack=2096 Win=31232 Len=1374 TSval=2408802486 TSecr=976619453"
"12438","237.108753","17.253.125.201","10.110.30.14","HTTP","576","[TCP Previous segment not captured] Continuation"
"13086","243.101238","18.2.197.80","10.110.30.14","HTTP","334","[TCP Previous segment not captured] Continuation"
"13318","244.205764","18.2.197.80","10.110.30.14","HTTP","390","[TCP Previous segment not captured] Continuation"
"13377","244.295539","18.2.197.80","10.110.30.14","HTTP","336","[TCP Previous segment not captured] Continuation"
"13460","244.654409","3.218.170.225","10.110.30.14","TCP","1440","443  >  59347 [ACK] Seq=4421324 Ack=151787 Win=315904 Len=1374 TSval=1407520965 TSecr=976627400"
"13555","245.003436","3.218.170.225","10.110.30.14","TCP","1440","443  >  59347 [ACK] Seq=4492772 Ack=151787 Win=315904 Len=1374 TSval=1407521314 TSecr=976627742"
"13872","246.086684","18.210.92.238","10.110.30.14","TCP","1251","[TCP Previous segment not captured] 443  >  59395 [PSH, ACK] Seq=4123 Ack=539 Win=28160 Len=1185 TSval=1329232965 TSecr=976628787"
"13874","246.089725","3.218.170.225","10.110.30.14","TCP","1440","[TCP Fast Retransmission] 443  >  59347 [ACK] Seq=4715360 Ack=151787 Win=315904 Len=1374 TSval=1407522400 TSecr=976628795"
"13984","246.494761","3.218.170.225","10.110.30.14","TCP","1440","443  >  59347 [ACK] Seq=4781312 Ack=151787 Win=315904 Len=1374 TSval=1407522806 TSecr=976629182"
"14600","248.773860","3.218.170.225","10.110.30.14","TCP","1440","443  >  59347 [ACK] Seq=5189390 Ack=151787 Win=315904 Len=1374 TSval=1407525085 TSecr=976631380 [TCP segment of a reassembled PDU]"
"14778","249.360115","3.218.170.225","10.110.30.14","TCP","1440","443  >  59347 [ACK] Seq=5318546 Ack=151787 Win=315904 Len=1374 TSval=1407525670 TSecr=976631943"
"14884","249.749665","3.218.170.225","10.110.30.14","TCP","1440","443  >  59347 [ACK] Seq=5395490 Ack=151787 Win=315904 Len=1374 TSval=1407526060 TSecr=976632321"
"15046","250.178955","3.218.170.225","10.110.30.14","TCP","1440","443  >  59347 [ACK] Seq=5520524 Ack=151787 Win=315904 Len=1374 TSval=1407526489 TSecr=976632740"
"16319","253.816424","104.155.105.154","10.110.30.14","TCP","1440","443  >  59398 [ACK] Seq=31731 Ack=7598 Win=42496 Len=1386"
"17104","277.918104","17.248.241.137","10.110.30.14","TCP","1414","[TCP Previous segment not captured] 443  >  59401 [PSH, ACK] Seq=2749 Ack=518 Win=64768 Len=1348 TSval=2136819104 TSecr=976660079"
"17105","277.918105","17.248.241.137","10.110.30.14","TCP","958","[TCP Previous segment not captured] 443  >  59401 [PSH, ACK] Seq=6845 Ack=518 Win=64768 Len=892 TSval=2136819104 TSecr=976660079"
"17791","310.322188","104.18.22.110","10.110.30.14","TCP","59","[TCP Previous segment not captured] 443  >  59407 [PSH, ACK] Seq=6315 Ack=1608 Win=68608 Len=5"
